<?xml version="1.0" encoding="UTF-8"?>
	<!ELEMENT scores (student+)>
	<!ELEMENT student (name,gender,score,course)>
	<!ATTLIST student id CDATA #REQUIRED>
	<!ELEMENT name (#PCDATA)>
	<!ELEMENT gender (#PCDATA)>
	<!ELEMENT score (#PCDATA)>
	<!ELEMENT course (#PCDATA)>
